{
  "call_id": "CALL-EVIDENCE-BUNDLE-001",
  "correlation_id": "CORRELATION-SIM-CLOSURE-001",
  "caller_id": "CALLER-AI-EVIDENCE-001",
  "caller_contract": {
    "contract_id": "CALLER-AI-EVIDENCE-001",
    "version": "1.0.0",
    "digest": "sha256:9090909090909090909090909090909090909090909090909090909090909090"
  },
  "operation_id": "OPERATION-EVIDENCE-BUNDLE-ASSEMBLE-001",
  "operation_version": "1.0.0",
  "input_digest": "sha256:4040404040404040404040404040404040404040404040404040404040404040",
  "scope": {
    "tenant_ids": [
      "TENANT-SYNTHETIC-001"
    ],
    "resource_types": [
      "evidence_bundle"
    ],
    "record_limit": 4,
    "data_classes": [
      "synthetic"
    ],
    "environment_classes": [
      "continuous_integration"
    ]
  },
  "effect_class": "broad_write",
  "boundary_decision": "authorized",
  "approval_ids": [
    "APPROVAL-SIM-EVIDENCE-001"
  ],
  "idempotency_fingerprint": "sha256:8080808080808080808080808080808080808080808080808080808080808080",
  "evidence_mode": "simulated",
  "outcome": "completed",
  "effect_ids": [
    "EFFECT-EVIDENCE-BUNDLE-001"
  ],
  "output_digest": "sha256:7070707070707070707070707070707070707070707070707070707070707070",
  "audit_artifact": {
    "artifact_id": "ARTIFACT-CALL-AUDIT-001",
    "media_type": "application/json",
    "digest": "sha256:a0a0a0a0a0a0a0a0a0a0a0a0a0a0a0a0a0a0a0a0a0a0a0a0a0a0a0a0a0a0a0a0",
    "locator": "evidence://simulation/audit/call-evidence-bundle-001",
    "sensitivity": "internal",
    "retention_class": "simulation-baseline"
  },
  "resource_usage": {
    "request_count": 1,
    "elapsed_milliseconds": 47,
    "retry_count": 0,
    "payload_bytes": 18432
  },
  "started_at": "2026-07-28T18:19:59Z",
  "completed_at": "2026-07-28T18:20:00Z",
  "recovery": {
    "owner_role": "Evidence service owner",
    "containment": "The service preserves the call receipt, idempotency fingerprint, approval, and completed effect.",
    "replacement_behavior": "An exact replay returns the recorded output digest and effect identifiers.",
    "verification": "The replay call reports outcome replayed with the same output digest and zero additional effects."
  },
  "metadata": {
    "schema_version": "2.0.0",
    "created_at": "2026-07-28T18:20:00Z",
    "updated_at": "2026-07-28T18:20:00Z",
    "owner": {
      "actor_id": "OWNER-EVIDENCE-SERVICE-001",
      "display_name": "Evidence Service Steward",
      "role": "Call receipt owner",
      "organization": "Example Laboratory"
    }
  }
}
